[
  {
    "geography": "48",
    "week": {
      "year": 2025,
      "week": 1
    },
    "status": "insufficient_data",
    "provisional": false,
    "mean": null,
    "lower": null,
    "upper": null,
    "interval_level": 0.9,
    "provenance": [
      {
        "source_id": "synthetic-web-test",
        "url": "https://example.invalid/synthetic-web-test",
        "retrieved_at": "2026-10-07T00:00:00Z",
        "sha256": "3b61a0986c3f9aacfd79db78c3709232b430d04c2ad6454916417e7a4a0cae7f",
        "licence_id": "synthetic-test-only"
      }
    ]
  },
  {
    "geography": "48",
    "week": {
      "year": 2025,
      "week": 2
    },
    "status": "ok",
    "provisional": false,
    "mean": 1.2,
    "lower": 0.7,
    "upper": 1.8,
    "interval_level": 0.9,
    "provenance": [
      {
        "source_id": "synthetic-web-test",
        "url": "https://example.invalid/synthetic-web-test",
        "retrieved_at": "2026-10-07T00:00:00Z",
        "sha256": "3b61a0986c3f9aacfd79db78c3709232b430d04c2ad6454916417e7a4a0cae7f",
        "licence_id": "synthetic-test-only"
      }
    ]
  },
  {
    "geography": "48",
    "week": {
      "year": 2025,
      "week": 3
    },
    "status": "ok",
    "provisional": false,
    "mean": 1.5,
    "lower": 0.9,
    "upper": 2.1,
    "interval_level": 0.9,
    "provenance": [
      {
        "source_id": "synthetic-web-test",
        "url": "https://example.invalid/synthetic-web-test",
        "retrieved_at": "2026-10-07T00:00:00Z",
        "sha256": "3b61a0986c3f9aacfd79db78c3709232b430d04c2ad6454916417e7a4a0cae7f",
        "licence_id": "synthetic-test-only"
      }
    ]
  },
  {
    "geography": "48",
    "week": {
      "year": 2025,
      "week": 4
    },
    "status": "insufficient_data",
    "provisional": false,
    "mean": null,
    "lower": null,
    "upper": null,
    "interval_level": 0.9,
    "provenance": [
      {
        "source_id": "synthetic-web-test",
        "url": "https://example.invalid/synthetic-web-test",
        "retrieved_at": "2026-10-07T00:00:00Z",
        "sha256": "3b61a0986c3f9aacfd79db78c3709232b430d04c2ad6454916417e7a4a0cae7f",
        "licence_id": "synthetic-test-only"
      }
    ]
  },
  {
    "geography": "48",
    "week": {
      "year": 2025,
      "week": 5
    },
    "status": "ok",
    "provisional": false,
    "mean": 0.8,
    "lower": 0.4,
    "upper": 1.3,
    "interval_level": 0.9,
    "provenance": [
      {
        "source_id": "synthetic-web-test",
        "url": "https://example.invalid/synthetic-web-test",
        "retrieved_at": "2026-10-07T00:00:00Z",
        "sha256": "3b61a0986c3f9aacfd79db78c3709232b430d04c2ad6454916417e7a4a0cae7f",
        "licence_id": "synthetic-test-only"
      }
    ]
  },
  {
    "geography": "48",
    "week": {
      "year": 2025,
      "week": 6
    },
    "status": "ok",
    "provisional": true,
    "mean": 0.7,
    "lower": 0.3,
    "upper": 1.2,
    "interval_level": 0.9,
    "provenance": [
      {
        "source_id": "synthetic-web-test",
        "url": "https://example.invalid/synthetic-web-test",
        "retrieved_at": "2026-10-07T00:00:00Z",
        "sha256": "3b61a0986c3f9aacfd79db78c3709232b430d04c2ad6454916417e7a4a0cae7f",
        "licence_id": "synthetic-test-only"
      }
    ]
  },
  {
    "geography": "40",
    "week": {
      "year": 2025,
      "week": 1
    },
    "status": "insufficient_data",
    "provisional": false,
    "mean": null,
    "lower": null,
    "upper": null,
    "interval_level": 0.9,
    "provenance": [
      {
        "source_id": "synthetic-web-test",
        "url": "https://example.invalid/synthetic-web-test",
        "retrieved_at": "2026-10-07T00:00:00Z",
        "sha256": "3b61a0986c3f9aacfd79db78c3709232b430d04c2ad6454916417e7a4a0cae7f",
        "licence_id": "synthetic-test-only"
      }
    ]
  },
  {
    "geography": "40",
    "week": {
      "year": 2025,
      "week": 2
    },
    "status": "insufficient_data",
    "provisional": false,
    "mean": null,
    "lower": null,
    "upper": null,
    "interval_level": 0.9,
    "provenance": [
      {
        "source_id": "synthetic-web-test",
        "url": "https://example.invalid/synthetic-web-test",
        "retrieved_at": "2026-10-07T00:00:00Z",
        "sha256": "3b61a0986c3f9aacfd79db78c3709232b430d04c2ad6454916417e7a4a0cae7f",
        "licence_id": "synthetic-test-only"
      }
    ]
  },
  {
    "geography": "40",
    "week": {
      "year": 2025,
      "week": 3
    },
    "status": "insufficient_data",
    "provisional": true,
    "mean": null,
    "lower": null,
    "upper": null,
    "interval_level": 0.9,
    "provenance": [
      {
        "source_id": "synthetic-web-test",
        "url": "https://example.invalid/synthetic-web-test",
        "retrieved_at": "2026-10-07T00:00:00Z",
        "sha256": "3b61a0986c3f9aacfd79db78c3709232b430d04c2ad6454916417e7a4a0cae7f",
        "licence_id": "synthetic-test-only"
      }
    ]
  },
  {
    "geography": "35",
    "week": {
      "year": 2025,
      "week": 1
    },
    "status": "insufficient_data",
    "provisional": false,
    "mean": null,
    "lower": null,
    "upper": null,
    "interval_level": 0.9,
    "provenance": [
      {
        "source_id": "synthetic-web-test",
        "url": "https://example.invalid/synthetic-web-test",
        "retrieved_at": "2026-10-07T00:00:00Z",
        "sha256": "3b61a0986c3f9aacfd79db78c3709232b430d04c2ad6454916417e7a4a0cae7f",
        "licence_id": "synthetic-test-only"
      }
    ]
  },
  {
    "geography": "35",
    "week": {
      "year": 2025,
      "week": 2
    },
    "status": "insufficient_data",
    "provisional": false,
    "mean": null,
    "lower": null,
    "upper": null,
    "interval_level": 0.9,
    "provenance": [
      {
        "source_id": "synthetic-web-test",
        "url": "https://example.invalid/synthetic-web-test",
        "retrieved_at": "2026-10-07T00:00:00Z",
        "sha256": "3b61a0986c3f9aacfd79db78c3709232b430d04c2ad6454916417e7a4a0cae7f",
        "licence_id": "synthetic-test-only"
      }
    ]
  },
  {
    "geography": "35",
    "week": {
      "year": 2025,
      "week": 3
    },
    "status": "insufficient_data",
    "provisional": true,
    "mean": null,
    "lower": null,
    "upper": null,
    "interval_level": 0.9,
    "provenance": [
      {
        "source_id": "synthetic-web-test",
        "url": "https://example.invalid/synthetic-web-test",
        "retrieved_at": "2026-10-07T00:00:00Z",
        "sha256": "3b61a0986c3f9aacfd79db78c3709232b430d04c2ad6454916417e7a4a0cae7f",
        "licence_id": "synthetic-test-only"
      }
    ]
  },
  {
    "geography": "48165",
    "week": {
      "year": 2025,
      "week": 1
    },
    "status": "insufficient_data",
    "provisional": false,
    "mean": null,
    "lower": null,
    "upper": null,
    "interval_level": 0.9,
    "provenance": [
      {
        "source_id": "synthetic-web-test",
        "url": "https://example.invalid/synthetic-web-test",
        "retrieved_at": "2026-10-07T00:00:00Z",
        "sha256": "3b61a0986c3f9aacfd79db78c3709232b430d04c2ad6454916417e7a4a0cae7f",
        "licence_id": "synthetic-test-only"
      }
    ]
  },
  {
    "geography": "48165",
    "week": {
      "year": 2025,
      "week": 2
    },
    "status": "ok",
    "provisional": false,
    "mean": 1.3,
    "lower": 0.8,
    "upper": 1.9,
    "interval_level": 0.9,
    "provenance": [
      {
        "source_id": "synthetic-web-test",
        "url": "https://example.invalid/synthetic-web-test",
        "retrieved_at": "2026-10-07T00:00:00Z",
        "sha256": "3b61a0986c3f9aacfd79db78c3709232b430d04c2ad6454916417e7a4a0cae7f",
        "licence_id": "synthetic-test-only"
      }
    ]
  },
  {
    "geography": "48165",
    "week": {
      "year": 2025,
      "week": 3
    },
    "status": "ok",
    "provisional": false,
    "mean": 1.6,
    "lower": 0.9,
    "upper": 2.3,
    "interval_level": 0.9,
    "provenance": [
      {
        "source_id": "synthetic-web-test",
        "url": "https://example.invalid/synthetic-web-test",
        "retrieved_at": "2026-10-07T00:00:00Z",
        "sha256": "3b61a0986c3f9aacfd79db78c3709232b430d04c2ad6454916417e7a4a0cae7f",
        "licence_id": "synthetic-test-only"
      }
    ]
  },
  {
    "geography": "48165",
    "week": {
      "year": 2025,
      "week": 4
    },
    "status": "insufficient_data",
    "provisional": false,
    "mean": null,
    "lower": null,
    "upper": null,
    "interval_level": 0.9,
    "provenance": [
      {
        "source_id": "synthetic-web-test",
        "url": "https://example.invalid/synthetic-web-test",
        "retrieved_at": "2026-10-07T00:00:00Z",
        "sha256": "3b61a0986c3f9aacfd79db78c3709232b430d04c2ad6454916417e7a4a0cae7f",
        "licence_id": "synthetic-test-only"
      }
    ]
  },
  {
    "geography": "48165",
    "week": {
      "year": 2025,
      "week": 5
    },
    "status": "ok",
    "provisional": false,
    "mean": 0.9,
    "lower": 0.4,
    "upper": 1.4,
    "interval_level": 0.9,
    "provenance": [
      {
        "source_id": "synthetic-web-test",
        "url": "https://example.invalid/synthetic-web-test",
        "retrieved_at": "2026-10-07T00:00:00Z",
        "sha256": "3b61a0986c3f9aacfd79db78c3709232b430d04c2ad6454916417e7a4a0cae7f",
        "licence_id": "synthetic-test-only"
      }
    ]
  },
  {
    "geography": "48165",
    "week": {
      "year": 2025,
      "week": 6
    },
    "status": "ok",
    "provisional": true,
    "mean": 0.7,
    "lower": 0.3,
    "upper": 1.2,
    "interval_level": 0.9,
    "provenance": [
      {
        "source_id": "synthetic-web-test",
        "url": "https://example.invalid/synthetic-web-test",
        "retrieved_at": "2026-10-07T00:00:00Z",
        "sha256": "3b61a0986c3f9aacfd79db78c3709232b430d04c2ad6454916417e7a4a0cae7f",
        "licence_id": "synthetic-test-only"
      }
    ]
  },
  {
    "geography": "48115",
    "week": {
      "year": 2025,
      "week": 1
    },